{
  "version": 1,
  "dealId": 1,
  "title": "Landing page redesign - delivery dispute",
  "question": "Did the freelancer deliver what was agreed?",
  "answers": [
    { "id": 1, "label": "Pay the freelancer" },
    { "id": 2, "label": "Refund the client" }
  ],
  "criteria": [
    "5 pages of designs delivered as Figma files",
    "Mobile responsive layouts for all breakpoints"
  ],
  "deliveryURI": "ipfs://mock-0000000000000000000000000000000000000000000000000000000000000001",
  "courtId": 2
}
